Record ID,Title,Author,Record Type,Subtype,Editor,Year of publication,Edition Details,Description,Subjects,CategoryNumbers,Language,Place Publisher,Physical Details,Series,ISBN,Pages Free Text,Record Action,Record Nature,FullyEntered,Proofed,SPW checked,Published Print,Published RLG,Link to Record,Journal Link,Journal Volume,Journal Issue,Advisor,School,Includes Series Article,Extent,Linked Data,Attributes,Related Authorities,Related Citations,Abstract,Staff Notes,Record History,Dataset,Complete Citation,Stub Record Status,Created Date,Modified Date,Creator,Modifier
CBB358409422,World-Building and the New Astronomy in Seventeenth-Century Prose Fictions of Cosmic Voyage,ACR_ID ACR029500587 || ACRStatus Active || ACRType Author || ACRDisplayOrder 1.0 || ACRNameForDisplayInCitation Evelyn Koch || AuthorityID CBA366042375 || AuthorityStatus Active || AuthorityType Person || AuthorityName Evelyn Koch // ACR_ID ACR518907184 || ACRStatus Active || ACRType Author || ACRDisplayOrder 2.0 || ACRNameForDisplayInCitation Florian Kläger || AuthorityID CBA874613038 || AuthorityStatus Active || AuthorityType Person || AuthorityName Florian Kläger,Book,,,2022,,,"ACR_ID ACR495130725 || ACRStatus Active || ACRType Subject || ACRDisplayOrder 1.0 || ACRNameForDisplayInCitation  || AuthorityID CBA000017288 || AuthorityStatus Active || AuthorityType Person || AuthorityName Cavendish, Margaret, Duchess of Newcastle // ACR_ID ACR892681877 || ACRStatus Active || ACRType Subject || ACRDisplayOrder 1.0 || ACRNameForDisplayInCitation  || AuthorityID CBA000017288 || AuthorityStatus Active || AuthorityType Person || AuthorityName Cavendish, Margaret, Duchess of Newcastle // ACR_ID ACR140101886 || ACRStatus Active || ACRType Subject || ACRDisplayOrder 1.0 || ACRNameForDisplayInCitation  || AuthorityID CBA000022803 || AuthorityStatus Active || AuthorityType Person || AuthorityName Cyrano de Bergerac, Savinien de // ACR_ID ACR466759360 || ACRStatus Active || ACRType Subject || ACRDisplayOrder 1.0 || ACRNameForDisplayInCitation  || AuthorityID CBA000037958 || AuthorityStatus Active || AuthorityType Person || AuthorityName Godwin, Francis // ACR_ID ACR256613135 || ACRStatus Active || ACRType Subject || ACRDisplayOrder 1.0 || ACRNameForDisplayInCitation  || AuthorityID CBA000053208 || AuthorityStatus Active || AuthorityType Person || AuthorityName Kepler, Johannes // ACR_ID ACR281874620 || ACRStatus Active || ACRType Subject || ACRDisplayOrder 1.0 || ACRNameForDisplayInCitation  || AuthorityID CBA000114071 || AuthorityStatus Active || AuthorityType Concept || AuthorityName Science and literature // ACR_ID ACR255723124 || ACRStatus Active || ACRType Subject || ACRDisplayOrder 1.0 || ACRNameForDisplayInCitation  || AuthorityID CBA000113996 || AuthorityStatus Active || AuthorityType Concept || AuthorityName Moon // ACR_ID ACR159516075 || ACRStatus Active || ACRType Subject || ACRDisplayOrder 1.0 || ACRNameForDisplayInCitation  || AuthorityID CBA923585340 || AuthorityStatus Active || AuthorityType Concept || AuthorityName Voyages and travels // ACR_ID ACR612265860 || ACRStatus Active || ACRType Subject || ACRDisplayOrder 1.0 || ACRNameForDisplayInCitation  || AuthorityID CBA000114357 || AuthorityStatus Active || AuthorityType Concept || AuthorityName Astronomy // ACR_ID ACR425202897 || ACRStatus Active || ACRType Subject || ACRDisplayOrder 1.0 || ACRNameForDisplayInCitation  || AuthorityID CBA650431716 || AuthorityStatus Active || AuthorityType Concept || AuthorityName Worldbuilding // ACR_ID ACR058795353 || ACRStatus Active || ACRType Subject || ACRDisplayOrder 1.0 || ACRNameForDisplayInCitation  || AuthorityID CBA000113707 || AuthorityStatus Active || AuthorityType Time Period || AuthorityName 17th century // ACR_ID ACR683553936 || ACRStatus Active || ACRType Publisher || ACRDisplayOrder 1.0 || ACRNameForDisplayInCitation Peter Lang GmbH, Internationaler Verlag der Wissenschaften || AuthorityID CBA856476184 || AuthorityStatus Active || AuthorityType Institution || AuthorityName Peter Lang Inc., International Academic Publishers",,English,"ACR_ID ACR683553936 || ACRStatus Active || ACRType Publisher || ACRDisplayOrder 1.0 || ACRNameForDisplayInCitation Peter Lang GmbH, Internationaler Verlag der Wissenschaften || AuthorityID CBA856476184 || AuthorityStatus Active || AuthorityType Institution || AuthorityName Peter Lang Inc., International Academic Publishers",246,,9783631862704,,,Active (RecordStatusExplanation Inactive by default),TRK396109345: 2024-07-09 02:43:57.465482+00:00,TRK907246738: 2024-07-09 02:43:57.817529+00:00,TRK512030463: 2025-02-11 17:03:13.833362+00:00,TRK001346843: 2025-02-11 17:05:18.900230+00:00,TRK976271000: 2025-02-11 17:06:53.661313+00:00,,,,,,,,246 (Note pages),Type ISBN || URN 9783631862704,"Type PublicationDate || Value [2022, 5, 10] || FreeFormValue 2022","ACR_ID ACR495130725 || ACRStatus Active || ACRType Subject || ACRDisplayOrder 1.0 || ACRNameForDisplayInCitation  || AuthorityID CBA000017288 || AuthorityStatus Active || AuthorityType Person || AuthorityName Cavendish, Margaret, Duchess of Newcastle // ACR_ID ACR892681877 || ACRStatus Active || ACRType Subject || ACRDisplayOrder 1.0 || ACRNameForDisplayInCitation  || AuthorityID CBA000017288 || AuthorityStatus Active || AuthorityType Person || AuthorityName Cavendish, Margaret, Duchess of Newcastle // ACR_ID ACR140101886 || ACRStatus Active || ACRType Subject || ACRDisplayOrder 1.0 || ACRNameForDisplayInCitation  || AuthorityID CBA000022803 || AuthorityStatus Active || AuthorityType Person || AuthorityName Cyrano de Bergerac, Savinien de // ACR_ID ACR466759360 || ACRStatus Active || ACRType Subject || ACRDisplayOrder 1.0 || ACRNameForDisplayInCitation  || AuthorityID CBA000037958 || AuthorityStatus Active || AuthorityType Person || AuthorityName Godwin, Francis // ACR_ID ACR256613135 || ACRStatus Active || ACRType Subject || ACRDisplayOrder 1.0 || ACRNameForDisplayInCitation  || AuthorityID CBA000053208 || AuthorityStatus Active || AuthorityType Person || AuthorityName Kepler, Johannes // ACR_ID ACR281874620 || ACRStatus Active || ACRType Subject || ACRDisplayOrder 1.0 || ACRNameForDisplayInCitation  || AuthorityID CBA000114071 || AuthorityStatus Active || AuthorityType Concept || AuthorityName Science and literature // ACR_ID ACR255723124 || ACRStatus Active || ACRType Subject || ACRDisplayOrder 1.0 || ACRNameForDisplayInCitation  || AuthorityID CBA000113996 || AuthorityStatus Active || AuthorityType Concept || AuthorityName Moon // ACR_ID ACR159516075 || ACRStatus Active || ACRType Subject || ACRDisplayOrder 1.0 || ACRNameForDisplayInCitation  || AuthorityID CBA923585340 || AuthorityStatus Active || AuthorityType Concept || AuthorityName Voyages and travels // ACR_ID ACR612265860 || ACRStatus Active || ACRType Subject || ACRDisplayOrder 1.0 || ACRNameForDisplayInCitation  || AuthorityID CBA000114357 || AuthorityStatus Active || AuthorityType Concept || AuthorityName Astronomy // ACR_ID ACR425202897 || ACRStatus Active || ACRType Subject || ACRDisplayOrder 1.0 || ACRNameForDisplayInCitation  || AuthorityID CBA650431716 || AuthorityStatus Active || AuthorityType Concept || AuthorityName Worldbuilding // ACR_ID ACR058795353 || ACRStatus Active || ACRType Subject || ACRDisplayOrder 1.0 || ACRNameForDisplayInCitation  || AuthorityID CBA000113707 || AuthorityStatus Active || AuthorityType Time Period || AuthorityName 17th century // ACR_ID ACR029500587 || ACRStatus Active || ACRType Author || ACRDisplayOrder 1.0 || ACRNameForDisplayInCitation Evelyn Koch || AuthorityID CBA366042375 || AuthorityStatus Active || AuthorityType Person || AuthorityName Evelyn Koch // ACR_ID ACR518907184 || ACRStatus Active || ACRType Author || ACRDisplayOrder 2.0 || ACRNameForDisplayInCitation Florian Kläger || AuthorityID CBA874613038 || AuthorityStatus Active || AuthorityType Person || AuthorityName Florian Kläger // ACR_ID ACR683553936 || ACRStatus Active || ACRType Publisher || ACRDisplayOrder 1.0 || ACRNameForDisplayInCitation Peter Lang GmbH, Internationaler Verlag der Wissenschaften || AuthorityID CBA856476184 || AuthorityStatus Active || AuthorityType Institution || AuthorityName Peter Lang Inc., International Academic Publishers","CCR_ID CCR211448603 || CCRStatus  Active || CCRType  Is Reviewed By || CitationID  CBB323325110 || CitationStatus  Active || CitationType  Review || CitationTitle  World-Building and the New Astronomy in Seventeenth-Century Prose Fictions of Cosmic Voyage, by Evelyn Koch","The book looks at ways of world-building in prose fictions of cosmic voyage in the seventeenth century. With the rise of the New Astronomy, there equally was a resurgence of the cosmic voyage in fiction. Various models of the universe were reimagined in prose form. Most of these voyages explore imagined versions of a world in the moon, such as the cosmic voyages by Johannes Kepler, Francis Godwin and Savinien Cyrano de Bergerac. In Margaret Cavendish’s The Blazing World, an eponymous imaginary planet is introduced. The book analyses the world-building of cosmic voyages by combining theories of world-building with contemporary concepts from early modern literature. It shows how imaginary worlds were created in early modern prose literature.",,"Created from Zotero accession 5980, performed at 2024-07-09 02:32:06.601829+00:00 by cslane. Subsequently ingested by cslane.","Isis Bibliography of the History of Science (Stephen P. Weldon, ed.)",,,2024-07-09 02:36:11.946772+00:00,2025-02-11 17:05:47.167625+00:00,  (cslane),  (IsisAdmin-SPW)
CBB945178406,"Review of ""Golden Years of Australian Radio Astronomy: An Illustrated History""","ACR_ID ACR949620930 || ACRStatus Active || ACRType Author || ACRDisplayOrder 1.0 || ACRNameForDisplayInCitation Harry Wendt || AuthorityID CBA000108723 || AuthorityStatus Active || AuthorityType Person || AuthorityName Wendt, Harry",Review,,,2023,,,,,English,,,,,596-597 (From 596 // To 597),,Active (RecordStatusExplanation Inactive by default),TRK385218641: 2024-07-17 18:49:21.146418+00:00,TRK266314261: 2024-07-17 18:49:21.578699+00:00,TRK760561163: 2025-02-11 17:03:17.925215+00:00,TRK404608704: 2025-02-11 17:05:22.672083+00:00,TRK225841499: 2025-02-11 17:07:05.063713+00:00,CBB544078385,AuthorityName Journal of Astronomical History and Heritage || AuthorityID CBA000123002 || AuthorityType Serial Publication || Abbreviation J. Astron. Hist. Herit. || ISSN 1440-2807,25 (From  // To ),3 (From  // To ),,,, (Note ),Type DOI || URN 10.3724/SP.J.1440-2807.2022.03.19 // Type URI || URN https://www.sciengine.com/10.3724/SP.J.1440-2807.2022.03.19,"Type PublicationDate || Value [2023, 1, 1] || FreeFormValue 2023","ACR_ID ACR949620930 || ACRStatus Active || ACRType Author || ACRDisplayOrder 1.0 || ACRNameForDisplayInCitation Harry Wendt || AuthorityID CBA000108723 || AuthorityStatus Active || AuthorityType Person || AuthorityName Wendt, Harry // ACR_ID ACR416614503 || ACRStatus Active || ACRType Periodical || ACRDisplayOrder 1.0 || ACRNameForDisplayInCitation Journal of Astronomical History and Heritage || AuthorityID CBA000123002 || AuthorityStatus Active || AuthorityType Serial Publication || AuthorityName Journal of Astronomical History and Heritage",CCR_ID CCR990039199 || CCRStatus  Active || CCRType  Is Reviewed By || CitationID  CBB544078385 || CitationStatus  Active || CitationType  Book || CitationTitle  Golden Years of Australian Radio Astronomy: An Illustrated History,,,"Created from Zotero accession 6037, performed at 2024-07-17 18:44:15.823326+00:00 by cslane. Subsequently ingested by cslane.","Isis Bibliography of the History of Science (Stephen P. Weldon, ed.)",,,2024-07-17 18:46:40.739087+00:00,2025-02-11 17:05:47.167625+00:00,  (cslane),  (IsisAdmin-SPW)
CBB371392428,"Review of ""Investigating Art, History, and Literature with Astronomy: Determining Time, Place, and Other Hidden Details Linked to the Stars""","ACR_ID ACR167827430 || ACRStatus Active || ACRType Author || ACRDisplayOrder 1.0 || ACRNameForDisplayInCitation Marion Dolan || AuthorityID CBA597252413 || AuthorityStatus Active || AuthorityType Person || AuthorityName Dolan, Marion ",Review,,,2023,,,,,English,,,,,591-592 (From 591 // To 592),,Active (RecordStatusExplanation Inactive by default),TRK214840921: 2024-07-17 18:50:21.942336+00:00,TRK786543209: 2024-07-17 18:50:22.156877+00:00,TRK866077494: 2025-02-11 17:03:17.931639+00:00,TRK330870182: 2025-02-11 17:05:22.678467+00:00,TRK394749947: 2025-02-11 17:07:05.093644+00:00,CBB851300964,AuthorityName Journal of Astronomical History and Heritage || AuthorityID CBA000123002 || AuthorityType Serial Publication || Abbreviation J. Astron. Hist. Herit. || ISSN 1440-2807,25 (From  // To ),3 (From  // To ),,,, (Note ),Type URI || URN https://www.sciengine.com/10.3724/SP.J.1440-2807.2022.03.16 // Type DOI || URN 10.3724/SP.J.1440-2807.2022.03.16,"Type PublicationDate || Value [2023, 1, 1] || FreeFormValue 2023","ACR_ID ACR167827430 || ACRStatus Active || ACRType Author || ACRDisplayOrder 1.0 || ACRNameForDisplayInCitation Marion Dolan || AuthorityID CBA597252413 || AuthorityStatus Active || AuthorityType Person || AuthorityName Dolan, Marion  // ACR_ID ACR577407975 || ACRStatus Active || ACRType Periodical || ACRDisplayOrder 1.0 || ACRNameForDisplayInCitation JAHH || AuthorityID CBA000123002 || AuthorityStatus Active || AuthorityType Serial Publication || AuthorityName Journal of Astronomical History and Heritage","CCR_ID CCR628370734 || CCRStatus  Active || CCRType  Is Reviewed By || CitationID  CBB851300964 || CitationStatus  Active || CitationType  Book || CitationTitle  Investigating Art, History, and Literature with Astronomy: Determining Time, Place, and Other Hidden Details Linked to the Stars",,,"Created from Zotero accession 6037, performed at 2024-07-17 18:44:15.823326+00:00 by cslane. Subsequently ingested by cslane.","Isis Bibliography of the History of Science (Stephen P. Weldon, ed.)",,,2024-07-17 18:46:42.972878+00:00,2025-02-11 17:05:47.167625+00:00,  (cslane),  (IsisAdmin-SPW)
CBB968814356,"Review of ""Alfonsine Astronomy: The Written Record""","ACR_ID ACR919917394 || ACRStatus Active || ACRType Author || ACRDisplayOrder 1.0 || ACRNameForDisplayInCitation C. Philipp E. Nothaft || AuthorityID CBA000074691 || AuthorityStatus Active || AuthorityType Person || AuthorityName Nothaft, C. Philipp E.",Review,,,2023,,,,,English,,,,,113-118 (From 113 // To 118),,Active (RecordStatusExplanation Inactive by default),TRK116734828: 2023-02-11 23:51:10.649426+00:00,TRK451786363: 2023-02-11 23:51:11.562566+00:00,TRK871654538: 2025-01-17 20:05:06.072178+00:00,TRK784824941: 2025-01-17 20:47:50.938900+00:00,TRK085156263: 2025-01-17 20:55:01.558397+00:00,CBB021681379,AuthorityName Journal for the History of Astronomy || AuthorityID CBA000122981 || AuthorityType Serial Publication || Abbreviation J. Hist. Astron. || ISSN 0021-8286,54 (From  // To ),1 (From  // To ),,,, (Note ),Type DOI || URN 10.1177/00218286221150437 // Type URI || URN https://journals.sagepub.com/doi/abs/10.1177/00218286221150437,"Type PublicationDate || Value [2023, 2, 1] || FreeFormValue 2023","ACR_ID ACR919917394 || ACRStatus Active || ACRType Author || ACRDisplayOrder 1.0 || ACRNameForDisplayInCitation C. Philipp E. Nothaft || AuthorityID CBA000074691 || AuthorityStatus Active || AuthorityType Person || AuthorityName Nothaft, C. Philipp E. // ACR_ID ACR636329611 || ACRStatus Active || ACRType Periodical || ACRDisplayOrder 1.0 || ACRNameForDisplayInCitation Journal for the History of Astronomy || AuthorityID CBA000122981 || AuthorityStatus Active || AuthorityType Serial Publication || AuthorityName Journal for the History of Astronomy",CCR_ID CCR225060593 || CCRStatus  Active || CCRType  Is Reviewed By || CitationID  CBB021681379 || CitationStatus  Active || CitationType  Book || CitationTitle  Alfonsine Astronomy: The Written Record,,,"Created from Zotero accession 4261, performed at 2023-02-11 23:50:12.264699+00:00 by rmarc. Subsequently ingested by rmarc.","Isis Bibliography of the History of Science (Stephen P. Weldon, ed.)",,,2023-02-11 23:50:48.164502+00:00,2025-01-17 20:54:43.333117+00:00,Rebecca Marcolina (rmarc),  (IsisAdmin-SPW)
CBB769076543,Experience and Observation in Hellenistic Astronomy,"ACR_ID ACR669346271 || ACRStatus Active || ACRType Author || ACRDisplayOrder 1.0 || ACRNameForDisplayInCitation Richard L. Kremer || AuthorityID CBA000056013 || AuthorityStatus Active || AuthorityType Person || AuthorityName Kremer, Richard L.",Chapter,,,2020,,,ACR_ID ACR819708685 || ACRStatus Active || ACRType Publisher || ACRDisplayOrder 1.0 || ACRNameForDisplayInCitation Brill || AuthorityID CBA000132493 || AuthorityStatus Active || AuthorityType Institution || AuthorityName Brill,,English,ACR_ID ACR819708685 || ACRStatus Active || ACRType Publisher || ACRDisplayOrder 1.0 || ACRNameForDisplayInCitation Brill || AuthorityID CBA000132493 || AuthorityStatus Active || AuthorityType Institution || AuthorityName Brill,,,,190-218 (From 190 // To 218),,Inactive (RecordStatusExplanation Inactive by default),,,,,,CBB957389708,,,,,,, (Note ),,"Type PublicationDate || Value [2020, 1, 1] || FreeFormValue 2020","ACR_ID ACR669346271 || ACRStatus Active || ACRType Author || ACRDisplayOrder 1.0 || ACRNameForDisplayInCitation Richard L. Kremer || AuthorityID CBA000056013 || AuthorityStatus Active || AuthorityType Person || AuthorityName Kremer, Richard L. // ACR_ID ACR819708685 || ACRStatus Active || ACRType Publisher || ACRDisplayOrder 1.0 || ACRNameForDisplayInCitation Brill || AuthorityID CBA000132493 || AuthorityStatus Active || AuthorityType Institution || AuthorityName Brill",CCR_ID CCR713540320 || CCRStatus  Active || CCRType  Includes Chapter || CitationID  CBB957389708 || CitationStatus  Active || CitationType  Book || CitationTitle  Hellenistic Astronomy: The Science in Its Contexts,,,"Created from Zotero accession 6054, performed at 2024-07-21 18:14:54.901188+00:00 by IsisAdmin-SPW. Subsequently ingested by IsisAdmin-SPW.

This record was changed as part of bulk change #8765. ""CBB Dataset"" was changed from ""Isis Bibliography of the History of Science (Stephen P. Weldon, ed.)"" to ""IsisCB Current Work"" by IsisAdmin-SPW on 02/13/25 01:15:42 AM UTC.",IsisCB Current Work,,,2024-07-21 18:22:34.236867+00:00,2025-02-13 01:18:47.638973+00:00,  (IsisAdmin-SPW),  (IsisAdmin-SPW)
CBB365172262,"Practical Astronomy in Fourteenth-Century Provence: Immanuel Ben Jacob Bonfils of Tarascon and the Construction of Astrolabes (study, Critical Edition, and Translation","ACR_ID ACR707385773 || ACRStatus Active || ACRType Author || ACRDisplayOrder 1.0 || ACRNameForDisplayInCitation Josefina Rodríguez Arribas || AuthorityID CBA000157877 || AuthorityStatus Active || AuthorityType Person || AuthorityName Rodríguez-Arribas, Josefina // ACR_ID ACR130277164 || ACRStatus Active || ACRType Author || ACRDisplayOrder 2.0 || ACRNameForDisplayInCitation Richard L. Kremer || AuthorityID CBA000056013 || AuthorityStatus Active || AuthorityType Person || AuthorityName Kremer, Richard L.",Article,,,2022,,,,,English,,,,,175-285 (From 175 // To 285),,Inactive (RecordStatusExplanation Inactive by default),,,,,,,AuthorityName Suhayl: Journal for the History of the Exact and Natural Sciences in Islamic Civilisation || AuthorityID CBA000124586 || AuthorityType Serial Publication || Abbreviation Suhayl || ISSN 2013-620X,19 (From  // To ),,,,, (Note ),,"Type PublicationDate || Value [2022, 1, 1] || FreeFormValue 2022","ACR_ID ACR707385773 || ACRStatus Active || ACRType Author || ACRDisplayOrder 1.0 || ACRNameForDisplayInCitation Josefina Rodríguez Arribas || AuthorityID CBA000157877 || AuthorityStatus Active || AuthorityType Person || AuthorityName Rodríguez-Arribas, Josefina // ACR_ID ACR130277164 || ACRStatus Active || ACRType Author || ACRDisplayOrder 2.0 || ACRNameForDisplayInCitation Richard L. Kremer || AuthorityID CBA000056013 || AuthorityStatus Active || AuthorityType Person || AuthorityName Kremer, Richard L. // ACR_ID ACR940228574 || ACRStatus Active || ACRType Periodical || ACRDisplayOrder 1.0 || ACRNameForDisplayInCitation Suhayl || AuthorityID CBA000124586 || AuthorityStatus Active || AuthorityType Serial Publication || AuthorityName Suhayl: Journal for the History of the Exact and Natural Sciences in Islamic Civilisation",,,,"Created from Zotero accession 6054, performed at 2024-07-21 18:14:54.901188+00:00 by IsisAdmin-SPW. Subsequently ingested by IsisAdmin-SPW.

This record was changed as part of bulk change #8765. ""CBB Dataset"" was changed from ""Isis Bibliography of the History of Science (Stephen P. Weldon, ed.)"" to ""IsisCB Current Work"" by IsisAdmin-SPW on 02/13/25 01:15:42 AM UTC.",IsisCB Current Work,,,2024-07-21 18:23:19.962414+00:00,2025-02-13 01:18:46.522679+00:00,  (IsisAdmin-SPW),  (IsisAdmin-SPW)
CBB854484202,Hellenistic astronomy: The science in its contexts,,Book,,"ACR_ID ACR610209440 || ACRStatus Active || ACRType Editor || ACRDisplayOrder 1.0 || ACRNameForDisplayInCitation Alan C. Bowen || AuthorityID CBA000011694 || AuthorityStatus Active || AuthorityType Person || AuthorityName Bowen, Alan C. // ACR_ID ACR644374013 || ACRStatus Active || ACRType Editor || ACRDisplayOrder 2.0 || ACRNameForDisplayInCitation Francesca Rochberg || AuthorityID CBA000086136 || AuthorityStatus Active || AuthorityType Person || AuthorityName Rochberg, Francesca",2020,,,ACR_ID ACR630081944 || ACRStatus Active || ACRType Publisher || ACRDisplayOrder 1.0 || ACRNameForDisplayInCitation Brill || AuthorityID CBA000132493 || AuthorityStatus Active || AuthorityType Institution || AuthorityName Brill,,English,ACR_ID ACR630081944 || ACRStatus Active || ACRType Publisher || ACRDisplayOrder 1.0 || ACRNameForDisplayInCitation Brill || AuthorityID CBA000132493 || AuthorityStatus Active || AuthorityType Institution || AuthorityName Brill,,,,,,Inactive (RecordStatusExplanation Inactive by default),,,,,,,,,,,,,,,"Type PublicationDate || Value [2020, 1, 1] || FreeFormValue 2020","ACR_ID ACR610209440 || ACRStatus Active || ACRType Editor || ACRDisplayOrder 1.0 || ACRNameForDisplayInCitation Alan C. Bowen || AuthorityID CBA000011694 || AuthorityStatus Active || AuthorityType Person || AuthorityName Bowen, Alan C. // ACR_ID ACR644374013 || ACRStatus Active || ACRType Editor || ACRDisplayOrder 2.0 || ACRNameForDisplayInCitation Francesca Rochberg || AuthorityID CBA000086136 || AuthorityStatus Active || AuthorityType Person || AuthorityName Rochberg, Francesca // ACR_ID ACR630081944 || ACRStatus Active || ACRType Publisher || ACRDisplayOrder 1.0 || ACRNameForDisplayInCitation Brill || AuthorityID CBA000132493 || AuthorityStatus Active || AuthorityType Institution || AuthorityName Brill",,,,"Created from Zotero accession 6054, performed at 2024-07-21 18:14:54.901188+00:00 by IsisAdmin-SPW. Subsequently ingested by IsisAdmin-SPW.

This record was changed as part of bulk change #8765. ""CBB Dataset"" was changed from ""Isis Bibliography of the History of Science (Stephen P. Weldon, ed.)"" to ""IsisCB Current Work"" by IsisAdmin-SPW on 02/13/25 01:15:42 AM UTC.",IsisCB Current Work,,,2024-07-21 18:23:13.856082+00:00,2025-02-13 01:18:46.810030+00:00,  (IsisAdmin-SPW),  (IsisAdmin-SPW)
