Record ID,Title,Author,Record Type,Subtype,Editor,Year of publication,Edition Details,Description,Subjects,CategoryNumbers,Language,Place Publisher,Physical Details,Series,ISBN,Pages Free Text,Record Action,Record Nature,FullyEntered,Proofed,SPW checked,Published Print,Published RLG,Link to Record,Journal Link,Journal Volume,Journal Issue,Advisor,School,Includes Series Article,Extent,Linked Data,Attributes,Related Authorities,Related Citations,Abstract,Staff Notes,Record History,Dataset,Complete Citation,Stub Record Status,Created Date,Modified Date,Creator,Modifier
CBB806101253,Advancing Cultural Astronomy: Studies In Honour of Clive Ruggles,,Book,,"ACR_ID ACR281656072 || ACRStatus Active || ACRType Editor || ACRDisplayOrder 1.0 || ACRNameForDisplayInCitation Efrosyni Boutsikas || AuthorityID CBA597491042 || AuthorityStatus Active || AuthorityType Person || AuthorityName Efrosyni Boutsikas // ACR_ID ACR479242338 || ACRStatus Active || ACRType Editor || ACRDisplayOrder 2.0 || ACRNameForDisplayInCitation Stephen C. McCluskey || AuthorityID CBA000066955 || AuthorityStatus Active || AuthorityType Person || AuthorityName McCluskey, Stephen Clement // ACR_ID ACR816506072 || ACRStatus Active || ACRType Editor || ACRDisplayOrder 3.0 || ACRNameForDisplayInCitation John Steele || AuthorityID CBA000097879 || AuthorityStatus Active || AuthorityType Person || AuthorityName Steele, John M.",2021,,,"ACR_ID ACR106798591 || ACRStatus Active || ACRType Subject || ACRDisplayOrder 1.0 || ACRNameForDisplayInCitation  || AuthorityID CBA430629241 || AuthorityStatus Active || AuthorityType Concept || AuthorityName Cultural astronomy // ACR_ID ACR287578627 || ACRStatus Active || ACRType Subject || ACRDisplayOrder 1.0 || ACRNameForDisplayInCitation  || AuthorityID CBA000116408 || AuthorityStatus Active || AuthorityType Concept || AuthorityName Discipline formation // ACR_ID ACR361026124 || ACRStatus Active || ACRType Subject || ACRDisplayOrder 1.0 || ACRNameForDisplayInCitation  || AuthorityID CBA000114087 || AuthorityStatus Active || AuthorityType Concept || AuthorityName Science, general histories // ACR_ID ACR870077027 || ACRStatus Active || ACRType Subject || ACRDisplayOrder 1.0 || ACRNameForDisplayInCitation  || AuthorityID CBA000118461 || AuthorityStatus Active || AuthorityType Concept || AuthorityName Ethnoastronomy // ACR_ID ACR917478005 || ACRStatus Active || ACRType Subject || ACRDisplayOrder 1.0 || ACRNameForDisplayInCitation  || AuthorityID CBA280424476 || AuthorityStatus Active || AuthorityType Concept || AuthorityName Skyscape; skyscapes // ACR_ID ACR833389554 || ACRStatus Active || ACRType Subject || ACRDisplayOrder 1.0 || ACRNameForDisplayInCitation  || AuthorityID CBA000088128 || AuthorityStatus Active || AuthorityType Person || AuthorityName Ruggles, Clive L. N. // ACR_ID ACR770471951 || ACRStatus Active || ACRType Subject || ACRDisplayOrder 1.0 || ACRNameForDisplayInCitation  || AuthorityID CBA000117472 || AuthorityStatus Active || AuthorityType Concept || AuthorityName Science and culture // ACR_ID ACR609016945 || ACRStatus Active || ACRType Subject || ACRDisplayOrder 1.0 || ACRNameForDisplayInCitation  || AuthorityID CBA000114354 || AuthorityStatus Active || AuthorityType Concept || AuthorityName Archaeoastronomy // ACR_ID ACR430133616 || ACRStatus Active || ACRType Publisher || ACRDisplayOrder 1.0 || ACRNameForDisplayInCitation Springer || AuthorityID CBA000138073 || AuthorityStatus Active || AuthorityType Institution || AuthorityName Springer",ACR_ID ACR702975872 || ACRStatus Active || ACRType Category || ACRDisplayOrder 1.0 || ACRNameForDisplayInCitation  || AuthorityID CBA000130307 || AuthorityStatus Active || AuthorityType Category Division || AuthorityName Astronomy and cosmology || ClassificationCode 110,English,ACR_ID ACR430133616 || ACRStatus Active || ACRType Publisher || ACRDisplayOrder 1.0 || ACRNameForDisplayInCitation Springer || AuthorityID CBA000138073 || AuthorityStatus Active || AuthorityType Institution || AuthorityName Springer,329,,9783030646059,,,Active (RecordStatusExplanation Inactive by default),TRK506644794: 2023-02-16 16:13:18.910832+00:00,TRK698019500: 2023-02-16 16:13:19.085018+00:00,TRK101719787: 2025-01-17 20:05:17.356970+00:00,TRK981052476: 2025-01-17 20:47:54.101275+00:00,TRK418765864: 2025-01-17 20:55:35.554524+00:00,,,,,,,,329 (Note pages),Type ISBN || URN 9783030646059,"Type PublicationDate || Value [2021, 4, 9] || FreeFormValue 2021","ACR_ID ACR106798591 || ACRStatus Active || ACRType Subject || ACRDisplayOrder 1.0 || ACRNameForDisplayInCitation  || AuthorityID CBA430629241 || AuthorityStatus Active || AuthorityType Concept || AuthorityName Cultural astronomy // ACR_ID ACR287578627 || ACRStatus Active || ACRType Subject || ACRDisplayOrder 1.0 || ACRNameForDisplayInCitation  || AuthorityID CBA000116408 || AuthorityStatus Active || AuthorityType Concept || AuthorityName Discipline formation // ACR_ID ACR702975872 || ACRStatus Active || ACRType Category || ACRDisplayOrder 1.0 || ACRNameForDisplayInCitation  || AuthorityID CBA000130307 || AuthorityStatus Active || AuthorityType Category Division || AuthorityName Astronomy and cosmology // ACR_ID ACR361026124 || ACRStatus Active || ACRType Subject || ACRDisplayOrder 1.0 || ACRNameForDisplayInCitation  || AuthorityID CBA000114087 || AuthorityStatus Active || AuthorityType Concept || AuthorityName Science, general histories // ACR_ID ACR870077027 || ACRStatus Active || ACRType Subject || ACRDisplayOrder 1.0 || ACRNameForDisplayInCitation  || AuthorityID CBA000118461 || AuthorityStatus Active || AuthorityType Concept || AuthorityName Ethnoastronomy // ACR_ID ACR917478005 || ACRStatus Active || ACRType Subject || ACRDisplayOrder 1.0 || ACRNameForDisplayInCitation  || AuthorityID CBA280424476 || AuthorityStatus Active || AuthorityType Concept || AuthorityName Skyscape; skyscapes // ACR_ID ACR833389554 || ACRStatus Active || ACRType Subject || ACRDisplayOrder 1.0 || ACRNameForDisplayInCitation  || AuthorityID CBA000088128 || AuthorityStatus Active || AuthorityType Person || AuthorityName Ruggles, Clive L. N. // ACR_ID ACR770471951 || ACRStatus Active || ACRType Subject || ACRDisplayOrder 1.0 || ACRNameForDisplayInCitation  || AuthorityID CBA000117472 || AuthorityStatus Active || AuthorityType Concept || AuthorityName Science and culture // ACR_ID ACR609016945 || ACRStatus Active || ACRType Subject || ACRDisplayOrder 1.0 || ACRNameForDisplayInCitation  || AuthorityID CBA000114354 || AuthorityStatus Active || AuthorityType Concept || AuthorityName Archaeoastronomy // ACR_ID ACR281656072 || ACRStatus Active || ACRType Editor || ACRDisplayOrder 1.0 || ACRNameForDisplayInCitation Efrosyni Boutsikas || AuthorityID CBA597491042 || AuthorityStatus Active || AuthorityType Person || AuthorityName Efrosyni Boutsikas // ACR_ID ACR479242338 || ACRStatus Active || ACRType Editor || ACRDisplayOrder 2.0 || ACRNameForDisplayInCitation Stephen C. McCluskey || AuthorityID CBA000066955 || AuthorityStatus Active || AuthorityType Person || AuthorityName McCluskey, Stephen Clement // ACR_ID ACR816506072 || ACRStatus Active || ACRType Editor || ACRDisplayOrder 3.0 || ACRNameForDisplayInCitation John Steele || AuthorityID CBA000097879 || AuthorityStatus Active || AuthorityType Person || AuthorityName Steele, John M. // ACR_ID ACR430133616 || ACRStatus Active || ACRType Publisher || ACRDisplayOrder 1.0 || ACRNameForDisplayInCitation Springer || AuthorityID CBA000138073 || AuthorityStatus Active || AuthorityType Institution || AuthorityName Springer",CCR_ID CCR457282911 || CCRStatus  Active || CCRType  Is Reviewed By || CitationID  CBB010909167 || CitationStatus  Active || CitationType  Review || CitationTitle  A Festschrift for Clive Ruggles,"This collection of essays on cultural astronomy celebrates the life and work of Clive Ruggles, Emeritus Professor of Archaeoastronomy at Leicester University. Taking their lead from Ruggles’ work, the papers present new research focused on three core themes in cultural astronomy: methodology, case studies, and heritage. Through this framework, they show how the study of cultural astronomy has evolved over time and share new ideas to continue advancing the field.Ruggles’ work in these areas has had a profound impact on the way that scholars approach evidence of the role of sky in both ancient and modern cultures. While the papers span many time periods and regions, they are closely connected by these three major themes, presenting methodological investigations of how we can approach archaeological, textual, and ethnographic evidence; describing detailed archaeoastronomical case studies; or stressing the importance of global heritage management.This work will appeal to researchers and scholars interested in the history and development of cultural astronomy.",,"Created from Zotero accession 4260, performed at 2023-02-11 23:33:58.647509+00:00 by rmarc. Subsequently ingested by rmarc.","Isis Bibliography of the History of Science (Stephen P. Weldon, ed.)",,,2023-02-11 23:38:56.564554+00:00,2025-01-17 20:54:43.333117+00:00,Rebecca Marcolina (rmarc),  (IsisAdmin-SPW)
CBB281957989,"Review of ""Beyond Paradigms in Cultural Astronomy: Proceedings of the 27th SEAC conference held together with the EAA""","ACR_ID ACR649234904 || ACRStatus Active || ACRType Author || ACRDisplayOrder 1.0 || ACRNameForDisplayInCitation Marion Dolan || AuthorityID CBA597252413 || AuthorityStatus Active || AuthorityType Person || AuthorityName Dolan, Marion  // ACR_ID ACR183023869 || ACRStatus Active || ACRType Author || ACRDisplayOrder 2.0 || ACRNameForDisplayInCitation Clifford Cunningham || AuthorityID CBA000022567 || AuthorityStatus Active || AuthorityType Person || AuthorityName Cunningham, Clifford J.",Review,,,2022,,,,,English,,,,,811-815 (From 811 // To 815),,Active (RecordStatusExplanation Inactive by default),TRK370402288: 2023-09-10 05:07:13.393874+00:00,TRK089651767: 2023-09-10 05:07:31.857931+00:00,TRK922335835: 2025-01-17 20:05:18.787335+00:00,TRK309352973: 2025-01-17 20:47:54.295041+00:00,TRK913163552: 2025-01-17 20:55:35.705722+00:00,CBB853572993,AuthorityName Journal of Astronomical History and Heritage || AuthorityID CBA000123002 || AuthorityType Serial Publication || Abbreviation J. Astron. Hist. Herit. || ISSN 1440-2807,25 (From  // To ),,,,, (Note ),Type URI || URN https://ui.adsabs.harvard.edu/abs/2022JAHH...25..811D,"Type PublicationDate || Value [2022, 12, 1] || FreeFormValue 2022","ACR_ID ACR649234904 || ACRStatus Active || ACRType Author || ACRDisplayOrder 1.0 || ACRNameForDisplayInCitation Marion Dolan || AuthorityID CBA597252413 || AuthorityStatus Active || AuthorityType Person || AuthorityName Dolan, Marion  // ACR_ID ACR183023869 || ACRStatus Active || ACRType Author || ACRDisplayOrder 2.0 || ACRNameForDisplayInCitation Clifford Cunningham || AuthorityID CBA000022567 || AuthorityStatus Active || AuthorityType Person || AuthorityName Cunningham, Clifford J. // ACR_ID ACR933465543 || ACRStatus Active || ACRType Periodical || ACRDisplayOrder 1.0 || ACRNameForDisplayInCitation Journal of Astronomical History and Heritage || AuthorityID CBA000123002 || AuthorityStatus Active || AuthorityType Serial Publication || AuthorityName Journal of Astronomical History and Heritage",CCR_ID CCR005000684 || CCRStatus  Active || CCRType  Is Reviewed By || CitationID  CBB853572993 || CitationStatus  Active || CitationType  Book || CitationTitle  Beyond Paradigms in Cultural Astronomy: Proceedings of the 27th SEAC conference held together with the EAA,,,"Created from Zotero accession 4838, performed at 2023-09-10 05:05:41.232014+00:00 by rmarc. Subsequently ingested by rmarc.","Isis Bibliography of the History of Science (Stephen P. Weldon, ed.)",,,2023-09-10 05:06:15.964937+00:00,2025-01-17 20:54:43.333117+00:00,Rebecca Marcolina (rmarc),  (IsisAdmin-SPW)
CBB317080745,Open Skies: The National Radio Astronomy Observatory and Its Impact on US Radio Astronomy,"ACR_ID ACR155352139 || ACRStatus Active || ACRType Author || ACRDisplayOrder 1.0 || ACRNameForDisplayInCitation Kenneth Kellermann || AuthorityID CBA562590573 || AuthorityStatus Active || AuthorityType Person || AuthorityName Kellermann, Kenneth // ACR_ID ACR075192213 || ACRStatus Active || ACRType Author || ACRDisplayOrder 2.0 || ACRNameForDisplayInCitation Archives Dept Associated Univ Inc NRAO || AuthorityID CBA584649563 || AuthorityStatus Active || AuthorityType Person || AuthorityName Bouton, Ellen N. // ACR_ID ACR895205852 || ACRStatus Active || ACRType Author || ACRDisplayOrder 3.0 || ACRNameForDisplayInCitation Sierra Smith || AuthorityID CBA716096933 || AuthorityStatus Active || AuthorityType Person || AuthorityName Brandt, Sierra S.",Book,,,2020,,,ACR_ID ACR784602157 || ACRStatus Active || ACRType Subject || ACRDisplayOrder 1.0 || ACRNameForDisplayInCitation  || AuthorityID CBA000116612 || AuthorityStatus Active || AuthorityType Concept || AuthorityName Research institutes; research stations // ACR_ID ACR478831006 || ACRStatus Active || ACRType Subject || ACRDisplayOrder 1.0 || ACRNameForDisplayInCitation  || AuthorityID CBA000113710 || AuthorityStatus Active || AuthorityType Time Period || AuthorityName 20th century // ACR_ID ACR348105682 || ACRStatus Active || ACRType Subject || ACRDisplayOrder 1.0 || ACRNameForDisplayInCitation  || AuthorityID CBA000113739 || AuthorityStatus Active || AuthorityType Concept || AuthorityName Radio astronomy // ACR_ID ACR564474161 || ACRStatus Active || ACRType Subject || ACRDisplayOrder 1.0 || ACRNameForDisplayInCitation  || AuthorityID CBA000115472 || AuthorityStatus Active || AuthorityType Institution || AuthorityName National Radio Astronomy Observatory (U.S.) // ACR_ID ACR043790068 || ACRStatus Active || ACRType Publisher || ACRDisplayOrder 1.0 || ACRNameForDisplayInCitation Springer International Publishing || AuthorityID CBA033529673 || AuthorityStatus Active || AuthorityType Institution || AuthorityName Springer International Publishing,ACR_ID ACR336089663 || ACRStatus Active || ACRType Category || ACRDisplayOrder 1.0 || ACRNameForDisplayInCitation  || AuthorityID CBA000131309 || AuthorityStatus Active || AuthorityType Category Division || AuthorityName Astronomy and cosmology -- 20th century || ClassificationCode 110-370,English,ACR_ID ACR043790068 || ACRStatus Active || ACRType Publisher || ACRDisplayOrder 1.0 || ACRNameForDisplayInCitation Springer International Publishing || AuthorityID CBA033529673 || AuthorityStatus Active || AuthorityType Institution || AuthorityName Springer International Publishing,676,,9783030323448,,,Active (RecordStatusExplanation Inactive by default),TRK625424409: 2021-07-30 03:51:13.103731+00:00,TRK656394638: 2021-07-30 03:51:52.821408+00:00,TRK445826033: 2021-12-16 21:56:00.397448+00:00,TRK620304920: 2021-12-16 22:11:12.470662+00:00,,,,,,,,,676 (Note pages),Type URI || URN https://www.springer.com/gp/book/9783030323448 // Type ISBN || URN 9783030323448,"Type PublicationDate || Value [2020, 1, 1] || FreeFormValue 2020","ACR_ID ACR336089663 || ACRStatus Active || ACRType Category || ACRDisplayOrder 1.0 || ACRNameForDisplayInCitation  || AuthorityID CBA000131309 || AuthorityStatus Active || AuthorityType Category Division || AuthorityName Astronomy and cosmology -- 20th century // ACR_ID ACR784602157 || ACRStatus Active || ACRType Subject || ACRDisplayOrder 1.0 || ACRNameForDisplayInCitation  || AuthorityID CBA000116612 || AuthorityStatus Active || AuthorityType Concept || AuthorityName Research institutes; research stations // ACR_ID ACR478831006 || ACRStatus Active || ACRType Subject || ACRDisplayOrder 1.0 || ACRNameForDisplayInCitation  || AuthorityID CBA000113710 || AuthorityStatus Active || AuthorityType Time Period || AuthorityName 20th century // ACR_ID ACR348105682 || ACRStatus Active || ACRType Subject || ACRDisplayOrder 1.0 || ACRNameForDisplayInCitation  || AuthorityID CBA000113739 || AuthorityStatus Active || AuthorityType Concept || AuthorityName Radio astronomy // ACR_ID ACR564474161 || ACRStatus Active || ACRType Subject || ACRDisplayOrder 1.0 || ACRNameForDisplayInCitation  || AuthorityID CBA000115472 || AuthorityStatus Active || AuthorityType Institution || AuthorityName National Radio Astronomy Observatory (U.S.) // ACR_ID ACR155352139 || ACRStatus Active || ACRType Author || ACRDisplayOrder 1.0 || ACRNameForDisplayInCitation Kenneth Kellermann || AuthorityID CBA562590573 || AuthorityStatus Active || AuthorityType Person || AuthorityName Kellermann, Kenneth // ACR_ID ACR075192213 || ACRStatus Active || ACRType Author || ACRDisplayOrder 2.0 || ACRNameForDisplayInCitation Archives Dept Associated Univ Inc NRAO || AuthorityID CBA584649563 || AuthorityStatus Active || AuthorityType Person || AuthorityName Bouton, Ellen N. // ACR_ID ACR895205852 || ACRStatus Active || ACRType Author || ACRDisplayOrder 3.0 || ACRNameForDisplayInCitation Sierra Smith || AuthorityID CBA716096933 || AuthorityStatus Active || AuthorityType Person || AuthorityName Brandt, Sierra S. // ACR_ID ACR043790068 || ACRStatus Active || ACRType Publisher || ACRDisplayOrder 1.0 || ACRNameForDisplayInCitation Springer International Publishing || AuthorityID CBA033529673 || AuthorityStatus Active || AuthorityType Institution || AuthorityName Springer International Publishing",CCR_ID CCR933300290 || CCRStatus  Active || CCRType  Is Reviewed By || CitationID  CBB690424037 || CitationStatus  Active || CitationType  Review || CitationTitle  An inside story of the NRAO,"This open access book on the history of the National Radio Astronomy Observatory covers the scientific discoveries and technical innovations of late 20th century radio astronomy with particular attention to the people and institutions involved. The authors have made extensive use of the NRAO Archives, which contain an unparalleled collection of documents pertaining to the history of radio astronomy, including the institutional records of NRAO as well as the personal papers of many of the pioneers of U.S. radio astronomy. Technical details and extensive citations to original sources are given in notes for the more technical readers, but are not required for an understanding of the body of the book. This book is intended for an audience ranging from interested lay readers to professional researchers studying the scientific, technical, political, and cultural development of a new science, and how it changed the course of 20th century astronomy.",,"On 2021-12-16 at 10:12PM, StephenPWeldon wrote: Printed in 2021.

On 2021-12-16 at 09:57PM, StephenPWeldon wrote: 

Created from Zotero accession 2919, performed at 2021-07-30 02:24:34.762186+00:00 by rmarc. Subsequently ingested by rmarc.","Isis Bibliography of the History of Science (Stephen P. Weldon, ed.)",,,2021-07-30 02:44:19.142582+00:00,2025-03-05 00:42:07.996078+00:00,Rebecca Marcolina (rmarc),Rebecca Marcolina (rmarc)
CBB466916356,"Review of ""The Birth of Modern Astronomy""","ACR_ID ACR187055338 || ACRStatus Active || ACRType Author || ACRDisplayOrder 1.0 || ACRNameForDisplayInCitation Robert W. Smith || AuthorityID CBA000095960 || AuthorityStatus Active || AuthorityType Person || AuthorityName Smith, Robert William",Review,,,2021,,,,,English,,,,,559-560 (From 559 // To 560),,Active (RecordStatusExplanation Inactive by default),TRK171256472: 2021-07-29 00:49:50.105793+00:00,TRK438084095: 2021-07-29 00:49:50.218215+00:00,TRK071279934: 2021-12-16 21:56:52.814593+00:00,TRK146773340: 2021-12-16 22:11:46.525970+00:00,,CBB858392112,AuthorityName Journal of Astronomical History and Heritage || AuthorityID CBA000123002 || AuthorityType Serial Publication || Abbreviation J. Astron. Hist. Herit. || ISSN 1440-2807,24 (From  // To ),2 (From  // To ),,,, (Note ),Type URI || URN https://ui.adsabs.harvard.edu/abs/2021JAHH...24..559C,"Type PublicationDate || Value [2021, 6, 1] || FreeFormValue 2021","ACR_ID ACR187055338 || ACRStatus Active || ACRType Author || ACRDisplayOrder 1.0 || ACRNameForDisplayInCitation Robert W. Smith || AuthorityID CBA000095960 || AuthorityStatus Active || AuthorityType Person || AuthorityName Smith, Robert William // ACR_ID ACR499914728 || ACRStatus Active || ACRType Periodical || ACRDisplayOrder 1.0 || ACRNameForDisplayInCitation Journal of Astronomical History and Heritage || AuthorityID CBA000123002 || AuthorityStatus Active || AuthorityType Serial Publication || AuthorityName Journal of Astronomical History and Heritage",CCR_ID CCR429332338 || CCRStatus  Active || CCRType  Is Reviewed By || CitationID  CBB858392112 || CitationStatus  Active || CitationType  Book || CitationTitle  The Birth of Modern Astronomy,,,"On 2021-12-16 at 10:12PM, StephenPWeldon wrote: Printed in 2021.

On 2021-12-16 at 09:57PM, StephenPWeldon wrote: 

Created from Zotero accession 2914, performed at 2021-07-28 01:56:28.577617+00:00 by rmarc. Subsequently ingested by rmarc.","Isis Bibliography of the History of Science (Stephen P. Weldon, ed.)",,,2021-07-28 02:14:27.774345+00:00,2021-12-16 22:12:20.463325+00:00,Rebecca Marcolina (rmarc),Stephen Weldon (StephenPWeldon)
